DayOrder,DayOfWeekStr,starttime,endtime,permit,PermitLocation,locationdesc,optionaltext,locationid,scheduleid,start24,end24,CNN,Addr_Date_Create,Addr_Date_Modified,block,lot,ColdTruck,Applicant,X,Y,Latitude,Longitude,Location
2,Tuesday,10AM,3PM,14MFF-0045,535 MISSION BAY BLVD SOUTH,"535 Mission Bay Blvd South: 1 Truck located on the south side of Mission Bay Blvd South between 3rd St and 4th St, approximately 80 linear feet east of the 4th St and Mission Bay Blvd South intersection. 6 Trucks located in the first 6 parking spaces on the east side of 4th Street between Mission Bay Blvd South and Nelson Rising Lane, just south of the 4th Street and Mission Bay Blvd South intersection.",7 Multiple Trucks on rotation (1 on Mission Bay Blvd South & 6 on 4th St).   Serving everything but hot dogs,526207,68368,10:00,15:00,15019101,05/22/2013 04:05:45 PM,05/22/2013 04:06:37 PM,8711,007,N,SF Cart Project,6015399.40053,2108558.93496,37.7705660724513,-122.390073746001,
2,Tuesday,10AM,3PM,11MFF-0040,561 MISSION ST,Yellow Zone,"Indian Style: BBQ, Variety of Curries, Rice, Wraps, Breads (Naan, Rotis, Parathas), Desserts, Pizza.  Beverages, Condiments, Indian Soups, Salads & Appetizer Varieties.",305727,414,10:00,15:00,9090000,03/07/2011 04:27:00 PM,03/07/2011 04:29:04 PM,3721,079,,Bombay Blvd.,6012947.16768,2115156.26681,37.7885445211484,-122.399019231479,
2,Tuesday,10AM,3PM,14MFF-0026,60 SPEAR ST,Truck located on the Spear St frontage in the middle yellow zone approximately 60 linear feet North of Mission.,"Sliders, Tater Tots, Beverages",526002,68067,10:00,15:00,12044000,10/28/2011 12:48:19 PM,10/28/2011 01:00:29 PM,3712,023,N,"Slider Shack, LLC.",6014221.58608,2116748.72228,37.792987967452,-122.394721470128,
2,Tuesday,10AM,3PM,11MFF-0040,86 03RD ST,"Located in the yellow zone, red parking metered spot, third spot.","Indian Style: BBQ, Variety of Curries, Rice, Wraps, Breads (Naan, Rotis, Parathas), Desserts, Pizza.  Beverages, Condiments, Indian Soups, Salads & Appetizer Varieties.",305735,428,10:00,15:00,165000,03/07/2011 04:36:55 PM,03/07/2011 04:38:19 PM,3706,093,,Bombay Blvd.,6011984.13271,2114388.83459,37.7863836212372,-122.402297224865,
2,Tuesday,10AM,4PM,14MFF-0094,1700 EVANS AVE,Set-up at 398 Quint Street: 10:30am-4:00pmm,"Mexican food: tacos, burritos, tortas, various meat and chicken and fish plate, chile relleno plate, fish plate, bread, flan, rice pudding, bread, fruit juice, vegetable juice, coffee, tea",532727,72477,10:00,16:00,10829000,07/25/2011 09:17:47 AM,07/25/2011 09:18:04 AM,5227,001,N,Tacos El Primo,6015127.02922,2098933.73356,37.7441222181346,-122.390343286511,
2,Tuesday,10AM,4PM,14MFF-0103,401 TREAT AVE,Located on the West side of the Harrison St frontage at the corner of 17th St,"Tacos, Burritos, Tortas, Quesadillas, Drinks",547025,736201,10:00,16:00,6746000,03/04/2011 11:50:24 AM,03/04/2011 11:56:57 AM,3573,023,N,El Tonayense #60,6008569.45364,2106219.67883,37.7637618472594,-122.413533208474,
2,Tuesday,10AM,4PM,11MFF-0075,450 SANSOME ST,Truck located on the east side of Sansome St at Commercial St - this section of Commercial is a non-vehicular,"chicken, beef, vegetables skewers",320613,2670,10:00,16:00,11548000,06/02/2011 12:32:34 PM,06/02/2011 12:32:57 PM,0229,018,,Ninja Food Products,6012320.93077,2117318.99689,37.7944479492361,-122.401337974284,
2,Tuesday,10AM,6PM,14MFF-0063,3055 23RD ST,10am to 6pm Mon thru Friday,"Burritos, Giros, Tortas, Quesadillas, Tacos & Various Beverages",526827,70904,10:00,18:00,1260000,05/27/2011 03:38:38 PM,05/27/2011 03:40:23 PM,3640,039,N,El Gallo Jiro,6008603.01478,2102703.03437,37.754107828202,-122.413168445667,
2,Tuesday,10AM,6PM,14MFF-0096,773 MARKET ST,Pushcart located on Market St. 7 linear feet West of the Fire Hydrant. Must maintain 8 linear feet clearance from Street Artist Booth M22. Reference Street Artist Map #14 (http://www.sfartscommission.org/street_artists_program/maps/index.html) ,"Kettle Corn, Funnel Cakes, Lemonade, Beverages, Flan",534613,72511,10:00,18:00,8746103,11/15/2011 01:48:04 PM,11/15/2011 01:50:08 PM,3706,096,N,Kettle Corn Star,6011164.82111,2114324.40143,37.7861609344287,-122.405127311306,
2,Tuesday,10AM,6PM,14MFF-0017,865 MARKET ST,34 LF east from the Westfield entrance way near the curb,"Kettle Corn, Funnel Cakes, Waffles, Lemonade",523277,58834,10:00,18:00,8747103,07/17/2012 04:14:14 PM,07/17/2012 04:15:13 PM,3705,042,N,Kettle Corn Star,6010532.97528,2113742.67378,37.7845283055703,-122.407272318144,
2,Tuesday,10AM,7PM,14MFF-0009,1709 REVERE AVE,Truck located at the intersection of 3rd St/Revere St/ Bay View St,Watermelon,519939,58722,10:00,19:00,10979000,05/29/2012 04:04:18 PM,05/29/2012 04:04:44 PM,5343,033,N,Bob Johnson,6014616.00674,2094722.96687,37.7325319595578,-122.391815933696,
2,Tuesday,10AM,7PM,13MFF-0088,1717 HARRISON ST,Just North of Best Buy's curb cut,"Tacos, Burritos, Tortas, Quesadillas",428674,18274,10:00,19:00,6740000,03/04/2011 01:14:52 PM,10/24/2011 11:03:49 AM,3901,001,N,El Tonayanse #4 / #36,6008669.77932,2108251.24409,37.7693456875221,-122.413329888831,
2,Tuesday,10AM,7PM,13MFF-0115,954 MARKET ST,Push cart located on Market Street located 6' clearance away from the newspaper racks.,"Hot dogs, pretzels, chips, juices and cold drinks",502312,58517,10:00,19:00,8749201,12/12/2013 04:59:33 PM,12/12/2013 05:00:03 PM,0342,001,N,Yummy Hot Dogs,6009973.57943,2113287.97767,37.7832484947523,-122.409175549596,
2,Tuesday,10AM,7PM,14MFF-0009,Assessors Block 0733/Lot010,NE Corner of Webster & Eddy,Watermelon,519938,58715,10:00,19:00,0,04/21/2011 01:27:56 PM,04/21/2011 01:28:22 PM,0733,010,N,Bob Johnson,6003818.547,2113011.835,37.782143532929,-122.430449785949,
2,Tuesday,10AM,8PM,11MFF-0191,11 MARINA BLVD,"Pushcart located on the Laguna St sidewalk frontage, 12 linear feet South of the Marina Blvd / Laguna St crosswalk.","Kettle Corn, Shaved Ice, Soft Pretzels, Churros, Beverages",342374,6846,10:00,20:00,8701000,12/05/2011 09:09:42 AM,12/05/2011 09:10:20 AM,0446,003,N,Gourmet Kettle Corn,6003458.01553,2121393.38715,37.8051366970446,-122.432295848298,
2,Tuesday,10AM,8PM,13MFF-0130,1575 SOUTH VAN NESS AVE,Truck located....,"Mexican: Tacos, quesadillas, burritos, tortas. Colombian: Chorizo con arepa, potatoes & sausage, empanadas, arepa rellana, potatoes & guacamole.",498118,58485,10:00,20:00,12033000,11/20/2013 02:25:47 PM,11/20/2013 02:26:22 PM,6571,027,N,Mario's Colombian and Mexican Food,6007795.2125,2100664.86837,37.7484661020475,-122.415817718047,
2,Tuesday,10AM,8PM,14MFF-0051,298 KING ST,"Push cart located on the 4th Street Side approximately 40LF NW of the fire hydrant at the King/4th St intersection, closer to the third tree.  Not to block the pathway of the exit door of the building.","Gyros, Kebobs, refreshments and dessert",526305,68403,10:00,20:00,267001,10/06/2011 12:52:26 PM,,8702,606,N,"Kabob Trolley, LLC",6014275.8959,2110708.71965,37.7764065244709,-122.394110513855,
2,Tuesday,10AM,8PM,14MFF-0040,455 MARKET ST,Pushcart located on the South side of Market St. 125 west of Fremont St. (between bike rack and MUNI support pole),"Gyros, Kebabs, soft drinks, and water",526175,68270,10:00,20:00,8741101,09/29/2011 03:29:01 PM,09/29/2011 03:29:25 PM,3709,012,N,"Halal Cart, LLC",6013071.49353,2116142.24317,37.7912587083087,-122.398658299327,
2,Tuesday,10AM,8PM,13MFF-0094,5048 03RD ST,Truck located on the Revere Avenue frontage in the first parking space at the corner of 3rd St & Revere St.,"Wraps, Sandwiches, Chicken Wings, Fries, Lemonade, Juices",429253,18317,10:00,20:00,214201,03/22/2013 03:37:34 PM,03/22/2013 03:37:54 PM,5338,006,N,Your Community Foods,6014706.34676,2094842.9965,37.7328665512493,-122.391511992518,
2,Tuesday,10AM,8PM,11MFF-0175,901 MARKET ST,Pushcart located on the Market St sidewalk frontage approximately 5LF East of the Western property line.,"Kebab, Halal Gyros, Grilled Halal Meat, Beverages",334914,5772,10:00,20:00,8748101,09/26/2011 01:04:01 PM,09/26/2011 01:05:36 PM,3704,001,N,Halal Cart,6010316.03704,2113536.07269,37.7839488842882,-122.408008279363,
2,Tuesday,10AM,9PM,14MFF-0025,1020 03RD ST,West side of 3rd St 10am-8:30pm,"sunflower seeds, crackerjacks, bottled water, peanuts, candy",525993,68058,10:00,21:00,184001,06/20/2011 10:45:38 AM,06/20/2011 10:46:07 AM,8714,002,N,Got Snacks,6015443.07217,2110503.61845,37.7759081654088,-122.390058556767,
2,Tuesday,10AM,9PM,13MFF-0112,2101 CARROLL AVE,10:00am-9:00pm,"Tacos, Burritos , Tortas, Quesadillas & Beverages",453012,58356,10:00,21:00,3742000,10/25/2011 08:51:46 AM,10/25/2011 08:52:10 AM,5436,012,N,Tacos Santana,6011435.03753,2093950.28359,37.7302332323588,-122.402759048478,
2,Tuesday,11AM,12PM,14MFF-0092,1040 MARIPOSA ST,11:35am-11:40am,"Cold Truck: Sandwiches, Noodles,  Pre-packaged Snacks, Candy, Desserts Various Beverages",532516,72328,11:00,12:00,8717000,10/24/2011 04:29:02 PM,10/24/2011 04:29:18 PM,3987,012,Y,May Sun Kitchen,6014176.39047,2106211.41534,37.7640523949866,-122.394139809417,
2,Tuesday,11AM,12PM,14MFF-0092,1051 26TH ST,Set-up at 1500 Minnesota St: 11:20am-11:25am,"Cold Truck: Sandwiches, Noodles,  Pre-packaged Snacks, Candy, Desserts Various Beverages",532514,72318,11:00,12:00,1500000,10/24/2011 04:27:03 PM,10/24/2011 04:27:20 PM,4317,015,Y,May Sun Kitchen,6015254.61908,2101568.18928,37.7513629596296,-122.390086108654,
2,Tuesday,11AM,12PM,14MFF-0092,1090 26TH ST,11:50am-11:55am,"Cold Truck: Sandwiches, Noodles,  Pre-packaged Snacks, Candy, Desserts Various Beverages",532518,72338,11:00,12:00,1500000,10/24/2011 04:30:34 PM,10/24/2011 04:30:51 PM,4293,015,Y,May Sun Kitchen,6015145.52428,2101602.52301,37.7514511815096,-122.390465773031,
2,Tuesday,11AM,12PM,14MFF-0092,131 SHOTWELL ST,11:05am-11:15am,"Cold Truck: Sandwiches, Noodles,  Pre-packaged Snacks, Candy, Desserts Various Beverages",532513,72313,11:00,12:00,11833000,10/24/2011 04:24:53 PM,10/24/2011 04:25:09 PM,5501,003,Y,May Sun Kitchen,6007747.11363581,2107182.49340008,37.7663593026796,-122.41644564135,
2,Tuesday,11AM,12PM,14MFF-0092,1400 MINNESOTA ST,"8:20am-8:30am, 11:15am-11:20am","Cold Truck: Sandwiches, Noodles,  Pre-packaged Snacks, Candy, Desserts Various Beverages",532495,72203,11:00,12:00,9061000,10/24/2011 03:56:07 PM,10/24/2011 03:59:20 PM,4293,018,Y,May Sun Kitchen,6015358.18008,2101883.80675,37.7522353219293,-122.38975002217,
2,Tuesday,11AM,12PM,14MFF-0092,1575 INDIANA ST,11:55am-12:00pm,"Cold Truck: Sandwiches, Noodles,  Pre-packaged Snacks, Candy, Desserts Various Beverages",532519,72343,11:00,12:00,7200000,10/24/2011 04:31:15 PM,10/24/2011 04:31:31 PM,4317,017,Y,May Sun Kitchen,6015157.76194,2101239.03674,37.750453803667,-122.390398059007,
2,Tuesday,11AM,12PM,14MFF-0064,201 ALABAMA ST,Located approximately 100' North of the 15th St/ Florida intersection.,"Seafood, meats and desserts",526846,70919,11:00,12:00,24214000,03/14/2011 02:48:56 PM,06/14/2011 12:49:10 PM,3924,006,N,Fins on the Hoof / Saveurs,6008884.55425,2107581.73142,37.767519417299,-122.412539656202,
2,Tuesday,11AM,12PM,14MFF-0092,3000 03RD ST,11:30am-11:35am,"Cold Truck: Sandwiches, Noodles,  Pre-packaged Snacks, Candy, Desserts Various Beverages",532515,72323,11:00,12:00,195201,10/24/2011 04:27:57 PM,10/24/2011 04:28:11 PM,4315,008,Y,May Sun Kitchen,6015940.45733,2101621.91417,37.751548491531,-122.387718127295,
2,Tuesday,11AM,12PM,14MFF-0092,3150 03RD ST,"9:00am-9:05am, 11:25am-11:30am","Cold Truck: Sandwiches, Noodles,  Pre-packaged Snacks, Candy, Desserts Various Beverages",532500,72233,11:00,12:00,196000,10/24/2011 04:05:10 PM,10/24/2011 04:05:34 PM,4355,006,Y,May Sun Kitchen,6015963.74579,2100918.19989,37.7496175291101,-122.387588501326,
2,Tuesday,11AM,12PM,14MFF-0092,3255 03RD ST,11:40am-11:50am,"Cold Truck: Sandwiches, Noodles,  Pre-packaged Snacks, Candy, Desserts Various Beverages",532517,72333,11:00,12:00,197101,10/24/2011 04:29:48 PM,10/24/2011 04:30:05 PM,4377,001,Y,May Sun Kitchen,6016052.556,2100401.49551,37.748203685056,-122.387245352135,
2,Tuesday,11AM,12PM,14MFF-0092,3305 03RD ST,Set-up at 429 Amador St: 11:00am-11:05am,"Cold Truck: Sandwiches, Noodles,  Pre-packaged Snacks, Candy, Desserts Various Beverages",532512,72308,11:00,12:00,197101,10/24/2011 04:23:52 PM,10/24/2011 04:24:09 PM,4502A,002,Y,May Sun Kitchen,6016067.65644,2100153.34551,37.7475231528558,-122.387175828519,
2,Tuesday,11AM,12PM,14MFF-0107,860 02ND ST,"6:00am-6:05am, 11:00am-11:05am","Cold Truck: Pre-packaged sandwiches, Burgers, Hot Dogs, Muffin Sandwiches, Enchiladas, Bagels, Burritos, Salads, Snacks, Beverages",554525,736331,11:00,12:00,149000,09/07/2011 03:25:20 PM,09/07/2011 03:25:41 PM,3794,003,Y,Steve's Mobile Deli,6015720.22366201,2111802.08380127,37.779488829411,-122.389190496856,
2,Tuesday,11AM,12PM,14MFF-0107,390 01ST ST,"Set-up at 551 1st St. 6:10am-6:40am, 11:45am-12:00pm","Cold Truck: Pre-packaged sandwiches, Burgers, Hot Dogs, Muffin Sandwiches, Enchiladas, Bagels, Burritos, Salads, Snacks, Beverages",554540,736446,11:00,12:00,113000,09/07/2011 04:23:49 PM,09/07/2011 04:25:07 PM,3749,058,Y,Steve's Mobile Deli,6014637.42464,2114241.00243,37.7861254592402,-122.393107088067,
2,Tuesday,11AM,12PM,14MFF-0132,401 23RD ST,"located at 650 24th Street, 11am to 11:05am","Cold Truck: Breakfast, Sandwiches, Salads, Pre-Packaged Snacks, Beverages",597857,737123,11:00,12:00,1232000,05/12/2011 08:27:13 AM,05/12/2011 08:27:36 AM,4232,010,Y,BH & MT LLC,6016755.28448,2103051.78911,37.7555197319435,-122.384999937383,
2,Tuesday,11AM,12PM,14MFF-0107,48 WELSH ST,Set-up at 10 Welsh St. 11:10am-11:15am,"Cold Truck: Pre-packaged sandwiches, Burgers, Hot Dogs, Muffin Sandwiches, Enchiladas, Bagels, Burritos, Salads, Snacks, Beverages",554538,736431,11:00,12:00,13570000,09/07/2011 04:17:36 PM,09/07/2011 04:17:56 PM,3776,043,Y,Steve's Mobile Deli,6013480.37779,2111914.22765,37.7796723277022,-122.396946995316,
2,Tuesday,11AM,12PM,14MFF-0107,480 HOWARD ST,11:20am-11:22am,"Cold Truck: Pre-packaged sandwiches, Burgers, Hot Dogs, Muffin Sandwiches, Enchiladas, Bagels, Burritos, Salads, Snacks, Beverages",554539,736436,11:00,12:00,7032000,09/07/2011 04:18:44 PM,09/07/2011 04:19:35 PM,3725,103,Y,Steve's Mobile Deli,6013851.76611661,2115196.99179556,37.7887067092358,-122.395892291496,
2,Tuesday,11AM,12PM,14MFF-0107,50 RIZAL ST,"Set-up at 10 Tandang Sora. 6:45am-6:55am, 11:30am-11:35am","Cold Truck: Pre-packaged sandwiches, Burgers, Hot Dogs, Muffin Sandwiches, Enchiladas, Bagels, Burritos, Salads, Snacks, Beverages",554526,736335,11:00,12:00,11089000,09/07/2011 03:31:20 PM,09/07/2011 03:31:44 PM,3751,169,Y,Steve's Mobile Deli,6012946.55722,2112832.30465,37.7821634269963,-122.398858175825,
2,Tuesday,11AM,12PM,14MFF-0107,525 HOWARD ST,"Set-up at 501 Howard St. 8:50am-9:00am, 11:22am-11:25am","Cold Truck: Pre-packaged sandwiches, Burgers, Hot Dogs, Muffin Sandwiches, Enchiladas, Bagels, Burritos, Salads, Snacks, Beverages",554531,736384,11:00,12:00,7033000,09/07/2011 03:55:12 PM,09/07/2011 03:55:50 PM,3736,114,Y,Steve's Mobile Deli,6013663.0005,2114967.96857,37.7880673613338,-122.396529337443,
2,Tuesday,11AM,12PM,14MFF-0010,531 MISSION ST,Located in the Yellow meter approximately 20' from Shaw Alley,Cupcakes,520249,58765,11:00,12:00,9089000,03/08/2011 11:16:11 AM,10/25/2011 03:50:00 PM,3721,122,N,Kara's Cupcakes,6013132.25947,2115333.07148,37.7890402978513,-122.398391248497,
2,Tuesday,11AM,2PM,14MFF-0061,1155 BATTERY ST,Truck located on Battery St approximately 60 linear feet South of the Filbert St and Battery St crosswalk intersection.,"BBQ Sandwiches, BBQ lunch platters, sides (corn bread, beans, chili, potato salad, coleslaw), water, sodas, energy drinks, housemade iced tea.",526490,70894,11:00,14:00,2767000,11/20/2012 02:24:41 PM,11/20/2012 02:27:12 PM,0107,007,N,Smokin Warehouse Barbecue,6012247.79401,2120027.99743,37.8018821327273,-122.40178154754,
2,Tuesday,11AM,2PM,14MFF-0006,120 02ND ST,16 LF west of NW corner of 2nd and Minna Streets,"Filipino fusion food: taco, burrito, nachos, rice plates",519468,58697,11:00,14:00,132000,03/08/2011 08:32:42 AM,03/08/2011 08:33:42 AM,3722,002,N,Senor Sisig,6012804.75426,2114846.92109,37.7876871932612,-122.399490236599,
2,Tuesday,11AM,2PM,14MFF-0031,185 BERRY ST,"300 LF west, north side of Berry Street from the NW corner","Soup, salad, sandwiches, beverages, chips & cookies",526109,68179,11:00,14:00,2953000,01/18/2012 02:17:04 PM,08/06/2012 09:18:25 AM,3803,005,N,San Francisco Soup Company,6014611.60657,2110567.89709,37.7760385105764,-122.392939332071,
2,Tuesday,11AM,2PM,14MFF-0119,217 SANSOME ST,Set-up at 205-215 Sansome St,"Katsu Curry, KUROBUTA Sausage Curry, Vegetable Curry, Veggie Croquette Curry, Chicken NANBAN Bento, Nori Bento, water, soda, green tea",562281,736667,11:00,14:00,11544000,07/26/2011 12:47:35 PM,07/26/2011 12:54:07 PM,0260,004,N,JapaCurry,6012391.83827,2116525.91699,37.792274296118,-122.401036872913,
2,Tuesday,11AM,2PM,14MFF-0021,225 BUSH ST,,"Chicken Tiki Masala Burritos, Paneer Tiki Masala Burritos, Samosas, Mango Lassi",525602,58955,11:00,14:00,3422000,03/07/2011 10:26:59 AM,03/07/2011 10:27:35 AM,0289,001,N,Curry Up Now,6012351.63941,2116088.27731,37.7910703986756,-122.401145196973,
2,Tuesday,11AM,2PM,14MFF-0007,300 PINE ST,Truck located 60 linear feet West of the Sansome St. & Pine St. intersection.,"Filipino fusion food: tacos, burritos, nachos, rice plates. Various beverages.",519472,58702,11:00,14:00,10456000,04/10/2012 02:57:50 PM,04/10/2012 03:04:09 PM,0260,005,N,Senor Sisig,6012411.69042,2116483.85601,37.7921599140391,-122.40096522707,
2,Tuesday,11AM,2PM,14MFF-0119,400 HOWARD ST,Set-up at 420 Howard St,"Katsu Curry, KUROBUTA Sausage Curry, Vegetable Curry, Veggie Croquette Curry, Chicken NANBAN Bento, Nori Bento, water, soda, green tea",562280,736663,11:00,14:00,7032000,07/26/2011 12:45:47 PM,07/26/2011 12:46:08 PM,3720,008,N,JapaCurry,6014048.2034,2115391.83668,37.7892526344794,-122.395226296171,
2,Tuesday,11AM,3PM,14MFF-0028,1 SANSOME ST,,"Tacos, burritos, quesadillas, soda & water",526069,68075,11:00,15:00,11542000,07/27/2011 11:45:20 AM,07/27/2011 11:45:38 AM,0289,003,N,Tacos Rodriguez,6012494.74957,2115792.60905,37.7902665460329,-122.400629258559,
2,Tuesday,11AM,3PM,14MFF-0113,1 SANSOME ST,,"Tacos, Burritos, Tortas, Quesadillas, Mexican Drinks, Aguas Frescas",560699,736633,11:00,15:00,11542000,03/04/2011 10:52:16 AM,07/22/2011 12:45:55 PM,0289,003,N,"Santana ESG, Inc.",6012494.74957,2115792.60905,37.7902665460329,-122.400629258559,
2,Tuesday,11AM,3PM,14MFF-0087,100 SPEAR ST,Truck located on the East side of Spear St. 30 feet South of Misson St.,Peruvian Food,530483,72139,11:00,15:00,12045000,10/05/2012 10:37:42 AM,10/05/2012 10:39:41 AM,3717,001,N,Sanguchon,6014408.02769,2116553.28485,37.7924617059078,-122.394062679127,
2,Tuesday,11AM,3PM,14MFF-0132,170 OTIS ST,"6:45am to 8:30am, 11:30am to 3pm","Cold Truck: Breakfast, Sandwiches, Salads, Pre-Packaged Snacks, Beverages",597858,737133,11:00,15:00,10048000,05/12/2011 08:30:17 AM,10/24/2011 04:39:33 PM,3513,007,Y,BH & MT LLC,6006672.39446,2108737.26794,37.7705678488858,-122.420273262356,
2,Tuesday,11AM,4PM,14MFF-0088,337 VALENCIA ST,Truck located on east side of Valencia St 6' north of 351 Valencia,"Falafel Sandwiches, Fries, Soda, Iced Tea & Various Drinks.",531039,72142,11:00,16:00,13057001,06/17/2011 03:58:19 PM,09/14/2011 10:49:50 AM,3547,016,N,La Falafel,6006130.96918,2107630.03684,37.7674971328296,-122.422067389717,
2,Tuesday,11AM,4PM,14MFF-0088,363 VALENCIA ST,Truck located on east side of Valencia St 1st parking space south of 351 Valencia,"Falafel Sandwiches, Fries, Soda, Iced Tea & Various Drinks.",531040,72147,11:00,16:00,13057002,06/17/2011 04:03:22 PM,09/14/2011 10:49:17 AM,3547,033,N,La Falafel,6006139.17984,2107484.57481,37.7670981917075,-122.422028655379,
2,Tuesday,11AM,5PM,13MFF-0112,1700 JERROLD AVE,11:30am-5:00pm,"Tacos, Burritos , Tortas, Quesadillas & Beverages",453013,58349,11:00,17:00,7498000,10/25/2011 08:53:10 AM,10/25/2011 08:53:27 AM,5262,009,N,Tacos Santana,6014824.34611,2097412.82042,37.7399293110874,-122.391283611001,
2,Tuesday,11AM,6PM,14MFF-0070,934 BRANNAN ST,Truck located in front of entrance,"Italian subs, Cuban sandwich, Gyro",528309,71986,11:00,18:00,3089000,03/07/2011 02:13:02 PM,03/07/2011 02:13:40 PM,3781,008,N,Subs on Hubs,6010789.31566,2108770.9025,37.7708913228568,-122.40603508975,
2,Tuesday,11AM,7PM,14MFF-0043,801 MARKET ST,Located on south side of Market Street 40 LF west of 4th Street near curb,Kettle Corn,526187,68277,11:00,19:00,8747102,05/13/2011 08:43:14 AM,05/13/2011 08:43:36 AM,3705Z,001,N,Creme Brulee To Go,6010973.02311,2114153.60775,37.7856812513257,-122.405778850215,
2,Tuesday,11AM,8PM,15MFF-0002,1 DRUMM ST,Push-cart located on North Side of Market St.,"Chicken gyro, lamb gyro, chicken over rice, lamb over rice",613882,737192,11:00,20:00,4969000,01/27/2015 10:16:16 AM,01/27/2015 10:16:33 AM,0264,004,N,Halal Gyro Express,6013746.5108,2116857.14184,37.7932592372728,-122.396372870735,
2,Tuesday,11AM,9PM,14MFF-0056,532 MARKET ST,"Push cart located on Market St curbside along the concrete pillars, east of the Sutter St and Sansome St intersection.",Creme Brulee,526417,70702,11:00,21:00,8742201,10/25/2011 11:38:11 AM,10/25/2011 11:39:03 AM,0290,012,N,The Creme Brulee Cart,6012827.29795,2116012.84151,37.7908897937244,-122.399494126212,
2,Tuesday,11AM,9PM,14MFF-0133,97 01ST ST,,"smoked sausages, deer, wild boar, pheasant, buffalo, beef, turkey, coleslaw, vegetarian baked beans",598046,737137,11:00,21:00,103000,11/10/2014 02:59:55 PM,11/13/2014 07:48:16 AM,3709,008,N,Missing Link SF,6013377.47526,2115616.07782,37.7898310241126,-122.397562684622,
2,Tuesday,12PM,1PM,14MFF-0018,1000 HOLLISTER AVE,12:00pm-12:15pm,"Ice Cream, Pre-Packaged Chips, Candies, Bottled Water & Canned SODA",525563,58839,12:00,13:00,6961000,08/31/2011 01:24:17 PM,08/31/2011 01:24:32 PM,4943,002,Y,Singh Brothers Ice Cream,6014872.20285,2089703.55732,37.7187638807592,-122.390579577708,
2,Tuesday,12PM,1PM,14MFF-0092,1082 PENNSYLVANIA AVE,12:40pm-12:45pm,"Cold Truck: Sandwiches, Noodles,  Pre-packaged Snacks, Candy, Desserts Various Beverages",532524,72368,12:00,13:00,10337002,10/24/2011 04:34:56 PM,10/24/2011 04:35:15 PM,4224,095,Y,May Sun Kitchen,6014501.62402,2102078.27917,37.7527217661049,-122.392725753817,
2,Tuesday,12PM,1PM,14MFF-0018,1173 INGERSON AVE,Set-up at 1199 Ingerson Ave: 12:15pm-12:30pm,"Ice Cream, Pre-Packaged Chips, Candies, Bottled Water & Canned SODA",525564,58845,12:00,13:00,7252000,08/31/2011 01:27:34 PM,08/31/2011 01:29:01 PM,4968,035,Y,Singh Brothers Ice Cream,6013343.35232,2090443.81768,37.7207115524695,-122.395916084904,
2,Tuesday,12PM,1PM,14MFF-0092,1255 22ND ST,12:12pm-12:17pm,"Cold Truck: Sandwiches, Noodles,  Pre-packaged Snacks, Candy, Desserts Various Beverages",532521,72353,12:00,13:00,1165000,10/24/2011 04:32:48 PM,10/24/2011 04:33:05 PM,4167,009,Y,May Sun Kitchen,6014127.95906,2103838.591,37.757534443698,-122.394141190871,
2,Tuesday,12PM,1PM,14MFF-0055,1345 TURK ST,10:00am-10:15am & 12:00pm-12:15pm,"Cold Truck: packaged sandwiches, pitas, breakfast, cold and hot drinks, snacks",526406,70694,12:00,13:00,12728000,08/09/2011 11:05:28 AM,08/09/2011 11:05:51 AM,0756,001,Y,Munch A Bunch,6003593.05269,2112440.56598,37.7805621947803,-122.431189105466,
2,Tuesday,12PM,1PM,14MFF-0107,145 KING ST,"9:40am-9:45am, 12:00pm-12:05pm","Cold Truck: Pre-packaged sandwiches, Burgers, Hot Dogs, Muffin Sandwiches, Enchiladas, Bagels, Burritos, Salads, Snacks, Beverages",554536,736420,12:00,13:00,7832101,09/07/2011 04:12:09 PM,09/07/2011 04:12:40 PM,3794,003C,Y,Steve's Mobile Deli,6015358.90503249,2111600.82386693,37.7789161780122,-122.390426395944,
2,Tuesday,12PM,1PM,14MFF-0092,2030 03RD ST,12:35pm-12:40pm,"Cold Truck: Sandwiches, Noodles,  Pre-packaged Snacks, Candy, Desserts Various Beverages",532523,72363,12:00,13:00,187201,10/24/2011 04:34:11 PM,10/24/2011 04:34:30 PM,3995,105,Y,May Sun Kitchen,6015677.29531,2106131.10604,37.7639151913093,-122.388942967508,
2,Tuesday,12PM,1PM,14MFF-0018,2900 GRIFFITH ST,12:30pm-12:45pm,"Ice Cream, Pre-Packaged Chips, Candies, Bottled Water & Canned SODA",525565,58850,12:00,13:00,6548000,09/14/2011 09:20:54 AM,09/14/2011 09:30:52 AM,4973,001,Y,Singh Brothers Ice Cream,6015212.95063,2089043.01717,37.7169690643397,-122.389355637131,
2,Tuesday,12PM,1PM,14MFF-0010,400 HOWARD ST,Located in the yellow meters approximately 30' from the intersection of Howard & 1st St.,Cupcakes,520248,58760,12:00,13:00,7032000,03/08/2011 11:09:04 AM,10/25/2011 03:31:30 PM,3720,008,N,Kara's Cupcakes,6014048.2034,2115391.83668,37.7892526344794,-122.395226296171,
2,Tuesday,12PM,1PM,14MFF-0092,500 FRANCISCO ST,12:17pm-12:20pm,"Cold Truck: Sandwiches, Noodles,  Pre-packaged Snacks, Candy, Desserts Various Beverages",532522,72358,12:00,13:00,5762000,10/24/2011 04:33:26 PM,10/24/2011 04:33:46 PM,0042,022,Y,May Sun Kitchen,6008887.5091,2121134.53358,37.8047323091815,-122.413488050797,
2,Tuesday,12PM,1PM,14MFF-0064,500 HOWARD ST,Located approximately 100' West of the 1st St/Natoma St intersection.,"Seafood, meats and desserts",526845,70915,12:00,13:00,9507000,03/14/2011 02:39:10 PM,06/14/2011 12:47:29 PM,3721,011,N,Fins on the Hoof / Saveurs,6013778.7388,2115134.04818,37.7885298177102,-122.396140544185,
2,Tuesday,12PM,1PM,14MFF-0092,601 MARIPOSA ST,"9:40am-9:45am, 12:20pm-12:25pm","Cold Truck: Sandwiches, Noodles,  Pre-packaged Snacks, Candy, Desserts Various Beverages",532505,72268,12:00,13:00,8714000,10/24/2011 04:15:23 PM,10/24/2011 04:15:45 PM,3996,013,Y,May Sun Kitchen,6015409.88913,2106241.56276,37.764203655834,-122.389875569211,
2,Tuesday,12PM,1PM,14MFF-0092,640 TENNESSEE ST,"9:10am-9:15am, 12:25pm-12:30pm","Cold Truck: Sandwiches, Noodles,  Pre-packaged Snacks, Candy, Desserts Various Beverages",532501,72243,12:00,13:00,12482000,10/24/2011 04:09:50 PM,10/24/2011 04:10:14 PM,3996,012,Y,May Sun Kitchen,6015407.52592,2106068.769,37.7637290705316,-122.389871672284,
