DayOrder,DayOfWeekStr,starttime,endtime,permit,PermitLocation,locationdesc,optionaltext,locationid,scheduleid,start24,end24,CNN,Addr_Date_Create,Addr_Date_Modified,block,lot,ColdTruck,Applicant,X,Y,Latitude,Longitude,Location
3,Wednesday,5PM,10PM,13MFF-0112,2142 JERROLD AVE,Set-up at 2100 Jerrold Ave: 5:00pm-9:30pm,"Tacos, Burritos , Tortas, Quesadillas & Beverages",453014,58340,17:00,22:00,7501000,10/25/2011 08:58:59 AM,10/25/2011 08:59:27 AM,5230,011,N,Tacos Santana,6012560.69539,2099100.15603,37.7444364893036,-122.399228839168,
3,Wednesday,5PM,11PM,14MFF-0030,2772 MARIPOSA ST,Located on the north side of Mariposa west near the curb cut of intersection of Bryant and Mariposa Streets.,Wood Fired Pizzas,526090,68167,17:00,23:00,8733000,08/07/2012 09:20:43 AM,08/07/2012 09:21:30 AM,3970,004,N,"Del Popolo, LLC.",6009312.70102,2105942.80007,37.7630433072676,-122.410942976716,
3,Wednesday,5PM,6PM,14MFF-0010,118 KING ST,Located approximately 20' West of the King/2nd St crosswalk,Cupcakes,520246,58730,17:00,18:00,7832201,03/08/2011 10:53:56 AM,10/25/2011 03:15:06 PM,3794,010,N,Kara's Cupcakes,6015443.00709,2111862.81328,37.7796402072113,-122.390153758805,
3,Wednesday,5PM,6PM,14MFF-0018,360 PENINSULA AVE,5:00pm-5:15pm,"Ice Cream, Pre-Packaged Chips, Candies, Bottled Water & Canned SODA",525583,58941,17:00,18:00,10327000,09/14/2011 10:50:40 AM,09/14/2011 10:51:02 AM,5083,009,Y,Singh Brothers Ice Cream,6012279.71916,2086946.72593,37.7110500071211,-122.39934738525,
3,Wednesday,5PM,8PM,11MFF-0039,333 MARKET ST,Located on the South Wst Corner of Market & Beale.  2nd Yellow Parking Metered Space.,"Indian Style: BBQ, Variety of Curries, Rice, Wraps, Breads (Naan, Rotis, Parathas), Desserts, Pizza.  Beverages, Condiments, Indian Soups, Salads & Appetizer Varieties.",305715,409,17:00,20:00,2863000,03/07/2011 04:06:03 PM,03/07/2011 04:10:56 PM,3710,020,N,Bombay Blvd.,6013387.52482,2116443.46243,37.7921033879545,-122.397585967453,
3,Wednesday,5PM,8PM,11MFF-0039,50 MAIN ST,"Located 32' from the pedestrian crosswalk, crossing Main St.","Indian Style: BBQ, Variety of Curries, Rice, Wraps, Breads (Naan, Rotis, Parathas), Desserts, Pizza.  Beverages, Condiments, Indian Soups, Salads & Appetizer Varieties.",305709,394,17:00,20:00,8627000,03/07/2011 03:39:16 PM,03/07/2011 04:00:38 PM,3711,018,N,Bombay Blvd.,6013914.11331,2116552.08545,37.7924309489844,-122.395771565795,
3,Wednesday,5PM,8PM,11MFF-0040,561 MISSION ST,Yellow Zone,"Indian Style: BBQ, Variety of Curries, Rice, Wraps, Breads (Naan, Rotis, Parathas), Desserts, Pizza.  Beverages, Condiments, Indian Soups, Salads & Appetizer Varieties.",305727,422,17:00,20:00,9090000,03/07/2011 04:27:00 PM,03/07/2011 04:29:04 PM,3721,079,,Bombay Blvd.,6012947.16768,2115156.26681,37.7885445211484,-122.399019231479,
3,Wednesday,5PM,8PM,11MFF-0040,86 03RD ST,"Located in the yellow zone, red parking metered spot, third spot.","Indian Style: BBQ, Variety of Curries, Rice, Wraps, Breads (Naan, Rotis, Parathas), Desserts, Pizza.  Beverages, Condiments, Indian Soups, Salads & Appetizer Varieties.",305735,436,17:00,20:00,165000,03/07/2011 04:36:55 PM,03/07/2011 04:38:19 PM,3706,093,,Bombay Blvd.,6011984.13271,2114388.83459,37.7863836212372,-122.402297224865,
3,Wednesday,5PM,9PM,13MFF-0128,2664 MISSION ST,Truck located ....,"Hot dogs, chips, soda, corn on the cob, french fries",494583,58474,17:00,21:00,9124000,11/04/2013 03:20:24 PM,11/06/2013 11:36:10 AM,3636,009,N,Sinthya's Hot Dogs,6007001.26338,2102843.08426,37.7544023207176,-122.418717635916,
3,Wednesday,6AM,10AM,14MFF-0019,84 02ND ST,Truck located 49' NW of the 2nd St/ Mission St intersection,Espresso Drinks,525587,58946,06:00,10:00,131000,10/17/2011 11:25:24 AM,06/29/2012 10:08:02 AM,3707,011,N,"Expresso Subito, LLC.",6012626.49999,2115032.16422,37.7881858902879,-122.400119980486,
3,Wednesday,6AM,10PM,14MFF-0089,491 BAY SHORE BLVD,Truck located approximately 200 linear feet North of the Cortland and Bay Shore Blvd intersection. First parking space next to the yellow zone that clears the tree.,"Tacos, Burritos, Quesadillas, Tortas, Nachos, Hot Dogs,Soda, Water, Fruit Drinks",532142,72157,06:00,22:00,2801101,09/17/2012 12:09:31 PM,09/17/2012 12:11:09 PM,5598,008,N,San Pancho's Tacos,6010304.31738,2097376.17095,37.7395767907782,-122.406909482372,
3,Wednesday,6AM,12AM,14MFF-0084,1 THE EMBARCADERO,"Northeast Corner of Sacramento & Battery, on Sacramento. 58' East of the intersection.","Hot dogs, condiments, soft pretzels, soft drinks, coffee, cold beverages, pastries, bakery goods, cookies, ice cream, candy, soups, churros, chestnuts, nuts, fresh fruit, fruit juices, desserts, potato chips and popcorn.",530356,72122,06:00,24:00,11222000,09/06/2011 02:23:02 PM,09/06/2011 02:23:17 PM,0230,028,N,"San Francisco Carts & Concessions, Inc. DBA Stanley's Steamers Hot Dogs",6015958.31535,2112655.92683,37.7818464873205,-122.388426441806,
3,Wednesday,6AM,12AM,14MFF-0081,100 GEARY ST,"Northwest Corner of Grant & Geary St, on Geary","Hot dogs, condiments, soft pretzels, soft drinks, coffee, cold beverages, pastries, bakery goods, cookies, ice cream, candy, soups, churros, chestnuts, nuts, fresh fruit, fruit juices, desserts, potato chips and popcorn.",530349,72101,06:00,24:00,6108000,09/06/2011 10:27:06 AM,09/06/2011 10:27:21 AM,0309,003,N,"San Francisco Carts & Concessions, Inc. DBA Stanley's Steamers Hot Dogs",6011185.29921,2114925.94965,37.7878137881663,-122.405098834861,
3,Wednesday,6AM,12AM,14MFF-0083,100 POST ST,"Corner of Post and Kearny, on Post","Hot dogs, condiments, soft pretzels, soft drinks, coffee, cold beverages, pastries, bakery goods, cookies, ice cream, candy, soups, churros, chestnuts, nuts, fresh fruit, fruit juices, desserts, potato chips and popcorn.",530355,72115,06:00,24:00,10625000,09/06/2011 12:42:53 PM,09/06/2011 12:50:21 PM,0294,004,N,"San Francisco Carts & Concessions, Inc. DBA Stanley's Steamers Hot Dogs",6011600.06831,2115329.85806,37.7889460031071,-122.403692234115,
3,Wednesday,6AM,12AM,14MFF-0082,2 MONTGOMERY ST,"Northeast Corner of Market & Montgomery St, on Market","Hot dogs, condiments, soft pretzels, soft drinks, coffee, cold beverages, pastries, bakery goods, cookies, ice cream, candy, soups, churros, chestnuts, nuts, fresh fruit, fruit juices, desserts, potato chips and popcorn.",530353,72108,06:00,24:00,30735000,09/06/2011 11:07:31 AM,09/06/2011 11:07:46 AM,0291,007,N,"San Francisco Carts & Concessions, Inc. DBA Stanley's Steamers Hot Dogs",6012109.20022,2115389.99682,37.7891395577013,-122.401934924896,
3,Wednesday,6AM,12AM,14MFF-0078,233 GEARY ST,Fronting 229 Geary St at Stockton St,"Hot dogs, condiments, soft pretzels, soft drinks, coffee, cold beverages, pastries, bakery goods, cookies, ice cream, candy, soups, churros, chestnuts, nuts, fresh fruit, fruit juices, desserts, potato chips and popcorn.",530346,72080,06:00,24:00,6109000,09/02/2011 10:05:36 AM,09/02/2011 10:05:51 AM,0314,001,N,"San Francisco Carts & Concessions, Inc. DBA Stanley's Steamers Hot Dogs",6010595.60275,2114803.08271,37.787443441473,-122.407130420012,
3,Wednesday,6AM,12AM,14MFF-0077,251 GEARY ST,"Geary St, in front of Macy's","Hot dogs, condiments, soft pretzels, soft drinks, coffee, cold beverages, pastries, bakery goods, cookies, ice cream, candy, soups, churros, chestnuts, nuts, fresh fruit, fruit juices, desserts, potato chips and popcorn.",530344,72073,06:00,24:00,6109000,08/30/2011 12:39:27 PM,08/30/2011 12:39:42 PM,0314,014,N,"San Francisco Carts & Concessions, Inc. DBA Stanley's Steamers Hot Dogs",6010513.68683,2114791.62563,37.7874073985061,-122.407413025679,
3,Wednesday,6AM,12AM,14MFF-0076,345 STOCKTON ST,"Northwest Corner of Post & Stockton Streets, on Post","Hot dogs, condiments, soft pretzels, soft drinks, coffee, cold beverages, pastries, bakery goods, cookies, ice cream, candy, soups, churros, chestnuts, nuts, fresh fruit, fruit juices, desserts, potato chips and popcorn.",530342,72066,06:00,24:00,10628000,07/15/2011 12:14:55 PM,07/15/2011 12:15:12 PM,0295,016,N,"San Francisco Carts & Concessions, Inc. DBA Stanley's Steamers Hot Dogs",6010666.44243,2115341.30313,37.7889252304878,-122.406923276928,
3,Wednesday,6AM,12AM,14MFF-0079,5 THE EMBARCADERO,"Northeast Corner of California, Market, and Drumm St","Hot dogs, condiments, soft pretzels, soft drinks, coffee, cold beverages, pastries, bakery goods, cookies, ice cream, candy, soups, churros, chestnuts, nuts, fresh fruit, fruit juices, desserts, potato chips and popcorn.",530347,72087,06:00,24:00,30049000,09/02/2011 02:50:09 PM,09/02/2011 02:50:29 PM,0234,017,N,"San Francisco Carts & Concessions, Inc. DBA Stanley's Steamers Hot Dogs",6015955.31962,2112814.37008,37.7822813709122,-122.388447868215,
3,Wednesday,6AM,12AM,14MFF-0085,567 BAY ST,Bay & Taylor intersection. Located against the planter box wall in front of the cable car turn-around.,"Hot dogs, condiments, soft pretzels, soft drinks, coffee, cold beverages, pastries, bakery goods, cookies, ice cream, candy, soups, churros, chestnuts, nuts, fresh fruit, fruit juices, desserts, potato chips and popcorn.",530359,72129,06:00,24:00,25524000,09/06/2011 03:18:29 PM,09/06/2011 03:19:02 PM,0043,001,N,"San Francisco Carts & Concessions, Inc. DBA Stanley's Steamers Hot Dogs",6008072.54766,2121331.29447,37.8052267720474,-122.416322260146,
3,Wednesday,6AM,12AM,14MFF-0080,701 HOWARD ST,"Southeast Corner of 4th & Howard St, on Howard","Hot dogs, condiments, soft pretzels, soft drinks, coffee, cold beverages, pastries, bakery goods, cookies, ice cream, candy, soups, churros, chestnuts, nuts, fresh fruit, fruit juices, desserts, potato chips and popcorn.",530348,72094,06:00,24:00,7038000,09/06/2011 10:07:44 AM,09/06/2011 10:10:06 AM,3734,091,N,"San Francisco Carts & Concessions, Inc. DBA Stanley's Steamers Hot Dogs",6012496.50073,2113852.01595,37.7849382299627,-122.400486828595,
3,Wednesday,6AM,12AM,14MFF-0075,900 BEACH ST,"Northwest Corner of Hyde & Beach Streets, on Beach.  Approximately 12' West of the Hyde St & Beach St crosswalk. Located against the wall with plant/ bushes.","Hot dogs, condiments, soft pretzels, soft drinks, coffee,cold beverages, pastries, bakery goods, cookies, icecream, candy, soups, churros, chestnuts, nuts, fresh fruit, fruit juices, desserts, potato chips and popcorn.",530339,72059,06:00,24:00,2846000,08/31/2011 04:05:09 PM,08/31/2011 04:05:30 PM,0405,007,N,"San Francisco Carts & Concessions, Inc. DBA Stanley's Steamers Hot Dogs",6005895.59457,2121756.69017,37.8062721441523,-122.42388615342,
3,Wednesday,6AM,2PM,14MFF-0065,124 FOLSOM ST,Cart set-up at 298 Spear St in the first parking space North of Folsom Street,"Coffee, Espresso Drinks, Pastries, Water, Soda, Tea, Pre-Packaged Foods",526862,70925,06:00,14:00,12046000,04/14/2011 11:02:49 AM,11/02/2011 04:49:56 PM,3740,031,N,Curbside Coffee,6015201.73626,2115613.89646,37.7899264436726,-122.391250706732,
3,Wednesday,6AM,2PM,13MFF-0001,535 WASHINGTON ST,In front of 535 Washington Street,"Burgers, French Fries, Black Bean Burgers, Mac and Cheese, drinks",417966,13870,06:00,14:00,13408000,09/21/2011 10:49:52 AM,09/21/2011 10:50:05 AM,0207,033,N,Doc's of the Bay,6012020.19162,2117737.47738,37.7955802129896,-122.402408013716,
3,Wednesday,6AM,3PM,14MFF-0035,,"Located on the West side of the Davis St frontage, South of Broadway St",Grilled Cheese Sandwiches,526150,68255,06:00,15:00,4609000,03/16/2011 05:27:25 PM,03/16/2011 05:28:09 PM,0167,010,N,Cheese Gone Wild,6012974.89,2118691.505,37.7982529941715,-122.399171569524,
3,Wednesday,6AM,3PM,14MFF-0123,301 PINE ST,On Sansome St. approximately 36' from Pine St.,"Hot coffee, iced coffee, hot chocolate, tea, pastries",566664,737047,06:00,15:00,10456000,08/12/2014 02:00:37 PM,08/21/2014 08:14:21 AM,0268,001,N,Philz Coffee Truck,6012417.24934,2116444.24416,37.7920514593666,-122.400943208625,
3,Wednesday,6AM,3PM,14MFF-0108,301 PINE ST,West side of Sansome St. approximately 40' from Pine St.,"Coffee, tea, smoothies, juices, sodas, water, pastries, donuts, fruit, yogurt, chocolates",557395,736675,06:00,15:00,10456000,07/08/2014 11:08:15 AM,07/30/2014 01:08:46 PM,0268,001,N,Bulldog Coffee,6012417.24934,2116444.24416,37.7920514593666,-122.400943208625,
3,Wednesday,6AM,3PM,14MFF-0123,401 CALIFORNIA ST,On Sansome frontage approximately 40ft from California St. intersection,"Hot coffee, iced coffee, hot chocolate, tea, pastries",577538,737068,06:00,15:00,3528000,09/12/2014 09:26:12 AM,09/12/2014 11:10:31 AM,0260,001,N,Philz Coffee Truck,6012367.34464,2116791.76137,37.7930028753318,-122.401140310473,
3,Wednesday,6AM,4PM,11MFF-0177,250 CLAY ST,"Truck located on the West side of Davis St., 2nd parking stall 16 LF South from the curb return at Davis and Washington St.","Bacon burger, bacon grilled cheese, bacon sandwiches, bacon tacos, bacon fries, bacon strips, bacon caramel corn",338539,5897,06:00,16:00,4608000,10/28/2011 10:56:42 AM,,0204,023,N,Bacon Bacon,6013125.91611,2117610.19288,37.7952923836472,-122.398573051937,
3,Wednesday,6AM,5PM,13MFF-0108,150 CALIFORNIA ST,Truck located on the Front St frontage 53' North of the Front St /California St.,"Expresso drinks, assorted beverages (canned, bottled, home made), scones, croissants, bagels, soup, chili, parfaits, smoothies, frappes, milk shakes.",448921,58214,06:00,17:00,5869000,05/21/2013 10:37:53 AM,05/23/2013 04:33:09 PM,0236,019,N,"Expresso Subito, LLC.",6013215.37451,2116950.72951,37.7934866365953,-122.398217219171,
3,Wednesday,6AM,6PM,14MFF-0123,735 MONTGOMERY ST,On Montgomery St. approximately 87' from Jackson St. intersection,"Hot coffee, iced coffee, hot chocolate, tea, pastries",566666,737057,06:00,18:00,9306000,08/12/2014 02:01:27 PM,08/21/2014 08:24:06 AM,0195,001,N,Philz Coffee Truck,6011721.29541,2117837.61779,37.7958384844379,-122.40344930127,
3,Wednesday,6AM,7AM,14MFF-0107,390 01ST ST,"Set-up at 551 1st St. 6:10am-6:40am, 11:45am-12:00pm","Cold Truck: Pre-packaged sandwiches, Burgers, Hot Dogs, Muffin Sandwiches, Enchiladas, Bagels, Burritos, Salads, Snacks, Beverages",554540,736442,06:00,07:00,113000,09/07/2011 04:23:49 PM,09/07/2011 04:25:07 PM,3749,058,Y,Steve's Mobile Deli,6014637.42464,2114241.00243,37.7861254592402,-122.393107088067,
3,Wednesday,6AM,7AM,14MFF-0107,50 RIZAL ST,"Set-up at 10 Tandang Sora. 6:45am-6:55am, 11:30am-11:35am","Cold Truck: Pre-packaged sandwiches, Burgers, Hot Dogs, Muffin Sandwiches, Enchiladas, Bagels, Burritos, Salads, Snacks, Beverages",554526,736341,06:00,07:00,11089000,09/07/2011 03:31:20 PM,09/07/2011 03:31:44 PM,3751,169,Y,Steve's Mobile Deli,6012946.55722,2112832.30465,37.7821634269963,-122.398858175825,
3,Wednesday,6AM,7AM,14MFF-0107,860 02ND ST,"6:00am-6:05am, 11:00am-11:05am","Cold Truck: Pre-packaged sandwiches, Burgers, Hot Dogs, Muffin Sandwiches, Enchiladas, Bagels, Burritos, Salads, Snacks, Beverages",554525,736327,06:00,07:00,149000,09/07/2011 03:25:20 PM,09/07/2011 03:25:41 PM,3794,003,Y,Steve's Mobile Deli,6015720.22366201,2111802.08380127,37.779488829411,-122.389190496856,
3,Wednesday,6AM,8PM,11MFF-0184,2465 MISSION ST,Pushcart located in the center of the property along curbside approximately 215 linear feet North of the 21st St and Mission St intersection.,"Churros, pre-packaged snacks, tamales, beverages",339198,6793,06:00,20:00,9122002,11/04/2011 10:53:18 AM,11/22/2011 12:46:18 PM,3610,024,N,Leticia Montes,6006976.25959,2104016.08686,37.7576217081709,-122.418887293706,
3,Wednesday,6AM,8PM,14MFF-0102,25 MONTGOMERY ST,Located 200' South of Sutter St,Cupcakes,546632,737074,06:00,20:00,9297000,03/07/2011 01:48:34 PM,09/18/2014 11:59:21 AM,0292,001A,N,"Cupkates Bakery, LLC",6012058.41225,2115463.10968,37.7893374737403,-122.402115788121,
3,Wednesday,6AM,9AM,14MFF-0132,170 OTIS ST,"6:45am to 8:30am, 11:30am to 3pm","Cold Truck: Breakfast, Sandwiches, Salads, Pre-Packaged Snacks, Beverages",597858,737129,06:00,09:00,10048000,05/12/2011 08:30:17 AM,10/24/2011 04:39:33 PM,3513,007,Y,BH & MT LLC,6006672.39446,2108737.26794,37.7705678488858,-122.420273262356,
3,Wednesday,6AM,9PM,14MFF-0049,101 STOCKTON ST,"Push cart located at the NW corner of Stockton St & OFarrell St, on Stockton St.","Soft Pretzels, hot dogs, sausage, chips, popcorn, soda, espresso, cappucino, pastries, ice cream, italian sausages, shish-ka-bob, churros, juice, water, various drinks",526281,68390,06:00,21:00,12195000,11/21/2011 05:03:19 PM,11/21/2011 05:03:35 PM,0314,002,N,"The New York Frankfurter Co. of CA, Inc. DBA: Annie's Hot Dogs",6010779.5576,2114505.00456,37.786635282569,-122.406472958687,
3,Wednesday,6AM,9PM,14MFF-0050,800 MARKET ST,Located on Market St at the corner or Ellis/Stockton St intersection,"Soft pretzels, hot dogs, sausages, chips, popcorn, sodea, coffee, espresso, cappucino, pastries, ice cream, Italian sausages, shish-ka-bob, churros, juice, water, various drinks.",526283,68397,06:00,21:00,24892000,03/10/2011 12:14:44 PM,11/21/2011 04:59:06 PM,0329,001,N,"The New York Frankfurter Co. of CA, Inc. DBA: Annie's Hot Dogs",6010933.47047,2114187.91352,37.7857732348758,-122.40591810922,
3,Wednesday,6AM,9PM,14MFF-0048,870 MARKET ST,"Push cart located at the cable car turn around, adjacent to the queue line approximately 20' West from the entrance of the 890 Market St building.","Soft pretzels, hot dogs, sausages, chips, popcorn, soda, espresso, cappucino, pastry, ica cream, ices, italian sausage, shish-ka-bob, churros, juice, water, various drinks",526280,68383,06:00,21:00,8747202,12/14/2011 02:58:54 PM,12/14/2011 02:59:22 PM,0329,005,N,"The New York Frankfurter Co. of CA, Inc. DBA: Annie's Hot Dogs",6010593.36901,2113879.05243,37.7849061488879,-122.407072991554,
3,Wednesday,6PM,12AM,14MFF-0008,2301 MISSION ST,Set-up at 2305 Mission St,"Hot dogs and related toppings, non alcoholic beverages",519831,58709,18:00,24:00,9121000,11/04/2011 11:53:51 AM,11/04/2011 11:56:39 AM,3595,031,N,Leo's Hot Dogs,6006924.58765,2104953.02765,37.7601914209313,-122.41913245488,
3,Wednesday,6PM,8PM,14MFF-0070,Assessors Block 8711/Lot021,West side of 4th St btw China Basin and Mission Bay North,"Italian subs, Cuban sandwich, Gyro",528311,71995,18:00,20:00,0,05/24/2011 09:28:55 AM,12/23/2011 04:23:38 PM,8711,021,N,Subs on Hubs,6014914.89374,2108873.14738,37.7714019465879,-122.391771646847,
3,Wednesday,7AM,4PM,13MFF-0123,235 15TH ST,Truck located on 15th Street in the first parking space west of the 15th Street and Rhode Island intersection.,"100% Grass fed beef hot dogs, wellshire bacon wrapped hot dogs, beef & heirloom pork spicy link, smoked pork bratwurst, organic chicken apple sausage, Irish breakfast rolls, sandwiches, various sides (fries, potato salad, coleslaw, salad) & ice cream.",487908,58449,07:00,16:00,635000,10/22/2013 11:47:21 AM,10/22/2013 02:12:20 PM,3936,001,N,"Mr. Nice, LLC",6011599.02957,2107445.81451,37.7672981863691,-122.40314102991,
3,Wednesday,7AM,6PM,14MFF-0097,1455 MARKET ST,Truck located on the Mission St frontage in the first parking space NE of the 11th St and Mission Stintersection.,"Tacos, burritos, soda & juice",534669,72521,07:00,18:00,9108000,08/09/2011 09:30:49 AM,07/30/2013 04:34:52 PM,3507,040,N,GOZA GOZA TACO,6007200.79449,2110540.19739,37.7755480242469,-122.41857338597,
3,Wednesday,7AM,6PM,14MFF-0027,2901 03RD ST,Truck located on the Illinois St frontage approximately 130 linear feet south of the Illinois and 25th St frontage.,"Tacos, Burritos, Tortas, Quesadillas, Chips & Salsa & Various Beverages",526061,68070,07:00,18:00,194101,03/21/2013 11:11:33 AM,03/21/2013 11:11:55 AM,4296,010,N,Tacos El Flaco,6015963.49535,2102090.58042,37.7528366269157,-122.387671153653,
3,Wednesday,7AM,6PM,14MFF-0121,298 MARKET ST,Push cart located on the sidewalk approximately 15 linear feet West of the Market St & Drumm St intersection.,Indian Chai (Tea),566649,736689,07:00,18:00,8739201,03/26/2012 02:29:20 PM,05/01/2012 03:07:03 PM,0264,004,N,The Chai Cart,6013431.51129,2116567.78727,37.7924472039343,-122.397442495538,
3,Wednesday,7AM,6PM,14MFF-0095,353 BAY SHORE BLVD,Located on Bayshore Blvd between the two existing entry/exit curb cuts,"Tacos, Burritos, Tostadas, Flautas, Tostadas, Tortas, Pozole Menudo",534404,72504,07:00,18:00,2800102,09/16/2011 09:39:40 AM,09/16/2011 09:53:27 AM,5598,030,N,Giant Burrito,6010662.40945,2098302.59628,37.7421405864675,-122.405736586446,
3,Wednesday,7AM,6PM,12MFF-0084,400 MONTGOMERY ST,Push cart located on the California St sidewalk frontage approximately 80 linear feet East of the Montgomery St & California St intersection.,Hot Indian Chai (Tea) & Prepackaged Indian Snacks.,364615,13272,07:00,18:00,3529000,04/04/2012 12:56:31 PM,05/01/2012 03:15:53 PM,0239,009,N,The Chai Cart,6011914.70691,2116759.08617,37.7928878954774,-122.402704171869,
3,Wednesday,7AM,6PM,12MFF-0083,79 NEW MONTGOMERY ST,Push cart located on the sidewalk 25 linear feet NW of the Mission St & New Montgomery St intersection.,Hot Indian Chai (Tea),364218,13265,07:00,18:00,9543000,04/03/2012 02:59:22 PM,05/01/2012 03:10:59 PM,3707,014,N,The Chai Cart,6012448.52352,2114861.95448,37.7877086092889,-122.400723790401,
3,Wednesday,7AM,6PM,14MFF-0117,888 BRANNAN ST,In front of the main entrance on the Brannan St. frontage,"Garlic Noodles, Burgers, BBQ, Rotisserie, Spam Masubi, Asian inspired tacos & burritos, Sandwiches, Soups, Fried Oyster Sandwiches, Seafood, Vegetarian, Chinese dim sum, Empanadas.Various Ethnic Street Food: Hawaiianese, Vietnamese, Indian, Filipino, Japanese, Korean, Peruvian, Chinese, Italian & American. No Mexican food allowed.",560881,736654,07:00,18:00,3088000,08/02/2011 03:04:47 PM,08/02/2011 03:09:26 PM,3780,006,N,888 Brannan L.P.,6011037.27794,2109008.0037,37.7715562139518,-122.405194076275,
3,Wednesday,7AM,8AM,14MFF-0092,1347 DONNER AVE,7:40am-7:50am,"Cold Truck: Sandwiches, Noodles,  Pre-packaged Snacks, Candy, Desserts Various Beverages",532490,72179,07:00,08:00,4907000,10/24/2011 03:45:20 PM,10/24/2011 03:45:32 PM,4909,025,Y,May Sun Kitchen,6015279.11795,2090737.37116,37.7216250971345,-122.389245172961,
3,Wednesday,7AM,8AM,14MFF-0092,1420 CARROLL AVE,Set-up at 1440 Carroll Ave: 7:50am-7:55am,"Cold Truck: Sandwiches, Noodles,  Pre-packaged Snacks, Candy, Desserts Various Beverages",532491,72184,07:00,08:00,3736000,10/24/2011 03:49:32 PM,10/24/2011 03:49:44 PM,4879,023,Y,May Sun Kitchen,6015073.45753,2091290.27561,37.7231318599658,-122.389994696076,
3,Wednesday,7AM,8AM,14MFF-0107,175 BLUXOME ST,7:20am-7:25am,"Cold Truck: Pre-packaged sandwiches, Burgers, Hot Dogs, Muffin Sandwiches, Enchiladas, Bagels, Burritos, Salads, Snacks, Beverages",554529,736372,07:00,08:00,2994000,09/07/2011 03:49:09 PM,09/07/2011 03:49:24 PM,3785,030,Y,Steve's Mobile Deli,6012682.09151,2110086.82426,37.7746102279804,-122.399580294284,
3,Wednesday,7AM,8AM,14MFF-0092,2085 03RD ST,7:15am-7:30am,"Cold Truck: Sandwiches, Noodles,  Pre-packaged Snacks, Candy, Desserts Various Beverages",532489,72174,07:00,08:00,187101,10/24/2011 03:44:25 PM,10/24/2011 03:44:47 PM,3994,002,Y,May Sun Kitchen,6015765.88269,2105888.64696,37.7632543608742,-122.388619641722,
3,Wednesday,7AM,8AM,14MFF-0107,26 THE EMBARCADERO,Set-up at 1 Steuart St. 7:30am-8:00am,"Cold Truck: Pre-packaged sandwiches, Burgers, Hot Dogs, Muffin Sandwiches, Enchiladas, Bagels, Burritos, Salads, Snacks, Beverages",554530,736377,07:00,08:00,12547201,09/07/2011 03:52:41 PM,09/07/2011 03:52:58 PM,3714,002,Y,Steve's Mobile Deli,6016149.25396,2113612.76798,37.784484336939,-122.387832661816,
3,Wednesday,7AM,8AM,14MFF-0092,2660 NEWHALL ST,7:00am-7:15am,"Cold Truck: Sandwiches, Noodles,  Pre-packaged Snacks, Candy, Desserts Various Beverages",532488,72169,07:00,08:00,9582003,10/24/2011 03:38:17 PM,10/24/2011 03:43:45 PM,5434B,004,Y,May Sun Kitchen,6012453.59834,2092853.03964,37.72727724475,-122.399160735119,
3,Wednesday,7AM,8AM,14MFF-0107,275 STEUART ST,"7:10am-7:20am, 9:50am-9:55am","Cold Truck: Pre-packaged sandwiches, Burgers, Hot Dogs, Muffin Sandwiches, Enchiladas, Bagels, Burritos, Salads, Snacks, Beverages",554528,736362,07:00,08:00,12160001,09/07/2011 03:37:23 PM,09/07/2011 03:49:51 PM,3742,008,Y,Steve's Mobile Deli,6015214.39904,2116282.42165,37.7917627624843,-122.391253645033,
3,Wednesday,7AM,8AM,14MFF-0055,400 PARNASSUS AVE,Set-up at 500 Parnassus Ave - 7:00am-8:00am M-F,"Cold Truck: packaged sandwiches, pitas, breakfast, cold and hot drinks, snacks",526399,70657,07:00,08:00,10293000,08/09/2011 10:43:50 AM,08/09/2011 10:44:07 AM,1756,001,Y,Munch A Bunch,5996069.5611,2106506.45626,37.7638394608477,-122.456786975662,
3,Wednesday,7AM,8AM,14MFF-0107,750 02ND ST,"7:00am-7:05am, 10:30am-10:40am, 12:06pm-12:15pm","Cold Truck: Pre-packaged sandwiches, Burgers, Hot Dogs, Muffin Sandwiches, Enchiladas, Bagels, Burritos, Salads, Snacks, Beverages",554527,736352,07:00,08:00,148000,09/07/2011 03:33:16 PM,09/07/2011 03:34:22 PM,3794,002A,Y,Steve's Mobile Deli,6015462.86233,2112061.94317,37.780188074444,-122.390098985325,
3,Wednesday,7AM,8PM,14MFF-0016,11 PHELAN AVE,truck located on the west side of Phelan Ave approximately 150 feet north of Ocean Avenue,"Pakistani Indian food, and salad, cold and hot drinks, Pakistani soft drinks, Sohan halva, Pakistani Indian desserts, and fruit dessert",521861,58828,07:00,20:00,10390000,06/15/2011 04:20:14 PM,06/15/2011 04:21:02 PM,3180,001,N,BHUK Burger,5997029.45123,2091789.21922,37.7234846045488,-122.45240493053,
3,Wednesday,7AM,8PM,14MFF-0066,531 BAY SHORE BLVD,Truck located on the East side of Bay Shore Blvd between Waterloo & Marengo.,"Tacos, burritos, quesadillas, tortas, nachos (refried beans, cheese sauce, salsa fresca), carnes (beef, chicken, marinated pork, fried pork), canned beans, rice, sodas, horchata drinks.",527194,70932,07:00,20:00,2801102,10/19/2012 03:38:55 PM,10/19/2012 03:39:19 PM,5607,038,N,La Jefa,6010309.6071,2097104.29816,37.738830582567,-122.406872036334,
